{
  "$schema": "https://json-schema.org/draft/2020-12/schema",
  "type": "object",
  "properties": {
    "contract_version": {
      "const": "0.1.0"
    },
    "id": {
      "type": "string"
    },
    "data_mode": {
      "enum": [
        "demo",
        "live",
        "cached"
      ]
    },
    "provenance": {
      "type": "object",
      "properties": {
        "adapter": {
          "type": "string"
        },
        "source": {
          "type": "string"
        }
      },
      "required": [
        "adapter",
        "source"
      ],
      "additionalProperties": true
    },
    "observation_id": {
      "type": "string"
    },
    "generated_at": {
      "type": "string",
      "format": "date-time"
    },
    "status": {
      "enum": [
        "needs_review",
        "supported",
        "unsupported",
        "unavailable"
      ]
    },
    "condition": {
      "type": "object",
      "properties": {
        "id": {
          "type": "string"
        },
        "label": {
          "type": "string"
        },
        "confidence": {
          "type": "number",
          "minimum": 0,
          "maximum": 1
        },
        "uncertainty": {
          "type": "string"
        },
        "abstained": {
          "type": "boolean"
        },
        "candidate_id": {
          "type": "string"
        },
        "confidence_kind": {
          "type": "string"
        },
        "pathogen": {
          "type": "string"
        },
        "differentials": {
          "type": "array",
          "items": {
            "type": "object",
            "properties": {
              "signal": {
                "type": "string"
              },
              "condition_id": {
                "type": "string"
              },
              "label": {
                "type": "string"
              },
              "confidence": {
                "type": "number",
                "minimum": 0,
                "maximum": 1
              }
            },
            "required": [
              "signal",
              "condition_id",
              "label",
              "confidence"
            ]
          }
        },
        "severity": {
          "type": [
            "object",
            "null"
          ],
          "properties": {
            "affected_leaf_area_pct": {
              "type": "number",
              "minimum": 0,
              "maximum": 100
            },
            "level": {
              "type": "integer",
              "minimum": 0,
              "maximum": 4
            }
          },
          "required": [
            "affected_leaf_area_pct",
            "level"
          ]
        }
      },
      "required": [
        "id",
        "label",
        "confidence",
        "uncertainty"
      ],
      "additionalProperties": true
    },
    "environment": {
      "type": "object",
      "properties": {
        "status": {
          "enum": [
            "fresh",
            "stale",
            "unavailable"
          ]
        },
        "as_of": {
          "type": [
            "string",
            "null"
          ],
          "format": "date-time"
        },
        "temperature_c": {
          "type": [
            "number",
            "null"
          ]
        },
        "relative_humidity_pct": {
          "type": [
            "number",
            "null"
          ],
          "minimum": 0,
          "maximum": 100
        },
        "rainfall_mm": {
          "type": [
            "number",
            "null"
          ],
          "minimum": 0
        },
        "period_hours": {
          "type": "integer",
          "minimum": 1
        },
        "origin": {
          "enum": [
            "live",
            "cached"
          ]
        },
        "age_hours": {
          "type": "number",
          "minimum": 0
        },
        "source_id": {
          "type": "string"
        },
        "notes": {
          "type": "array",
          "items": {
            "type": "string"
          }
        }
      },
      "required": [
        "status",
        "as_of",
        "temperature_c",
        "relative_humidity_pct",
        "rainfall_mm"
      ],
      "additionalProperties": true
    },
    "map": {
      "type": "object",
      "properties": {
        "status": {
          "enum": [
            "available",
            "unavailable",
            "unsupported"
          ]
        },
        "type": {
          "const": "FeatureCollection"
        },
        "features": {
          "type": "array",
          "items": {
            "type": "object"
          }
        },
        "limitations": {
          "type": "string"
        },
        "value_kind": {
          "type": "string"
        },
        "calibrated": {
          "type": "boolean"
        },
        "crs": {
          "type": "string"
        },
        "scale": {
          "type": "array",
          "items": {
            "type": "number"
          },
          "minItems": 2,
          "maxItems": 2
        }
      },
      "required": [
        "status",
        "type",
        "features",
        "limitations"
      ],
      "additionalProperties": true
    },
    "scouting": {
      "type": "array",
      "items": {
        "type": "object",
        "properties": {
          "id": {
            "type": "string"
          },
          "text": {
            "type": "string"
          },
          "rank": {
            "type": "integer",
            "minimum": 1
          },
          "priority": {
            "type": "number",
            "minimum": 0,
            "maximum": 1
          },
          "location": {
            "type": "object",
            "properties": {
              "latitude": {
                "type": "number",
                "minimum": -90,
                "maximum": 90
              },
              "longitude": {
                "type": "number",
                "minimum": -180,
                "maximum": 180
              }
            },
            "required": [
              "latitude",
              "longitude"
            ]
          },
          "source_ids": {
            "type": "array",
            "items": {
              "type": "string"
            }
          }
        },
        "required": [
          "id",
          "text"
        ],
        "additionalProperties": true
      }
    },
    "recommendations": {
      "type": "array",
      "items": {
        "type": "object",
        "properties": {
          "id": {
            "type": "string"
          },
          "text": {
            "type": "string"
          },
          "source_ids": {
            "type": "array",
            "items": {
              "type": "string"
            }
          }
        },
        "required": [
          "id",
          "text",
          "source_ids"
        ],
        "additionalProperties": true
      }
    },
    "sources": {
      "type": "array",
      "items": {
        "type": "object",
        "properties": {
          "id": {
            "type": "string"
          },
          "title": {
            "type": "string"
          },
          "url": {
            "type": "string",
            "format": "uri"
          },
          "accessed_at": {
            "type": "string",
            "format": "date-time"
          }
        },
        "required": [
          "id",
          "title",
          "url",
          "accessed_at"
        ],
        "additionalProperties": true
      }
    },
    "offline": {
      "type": "object",
      "properties": {
        "cached": {
          "type": "boolean"
        },
        "stale": {
          "type": "boolean"
        },
        "sync_status": {
          "enum": [
            "local_only",
            "pending",
            "synced",
            "failed"
          ]
        }
      },
      "required": [
        "cached",
        "stale",
        "sync_status"
      ],
      "additionalProperties": true
    },
    "evidence": {
      "type": "array",
      "items": {
        "type": "object",
        "properties": {
          "label": {
            "type": "string"
          },
          "confidence": {
            "type": "number",
            "minimum": 0,
            "maximum": 1
          },
          "recognized": {
            "type": "boolean"
          }
        },
        "required": [
          "label",
          "confidence",
          "recognized"
        ]
      }
    },
    "weather_risk": {
      "type": "object",
      "properties": {
        "status": {
          "enum": [
            "available",
            "partial",
            "unavailable"
          ]
        },
        "class": {
          "enum": [
            "low",
            "moderate",
            "high",
            null
          ]
        },
        "favourable_day_fraction": {
          "type": [
            "number",
            "null"
          ],
          "minimum": 0,
          "maximum": 1
        },
        "calibrated": {
          "const": false
        }
      },
      "required": [
        "status",
        "class"
      ]
    },
    "review": {
      "type": "object",
      "properties": {
        "suggested": {
          "type": "boolean"
        },
        "reasons": {
          "type": "array",
          "items": {
            "type": "object",
            "properties": {
              "id": {
                "type": "string"
              },
              "text": {
                "type": "string"
              }
            },
            "required": [
              "id",
              "text"
            ]
          }
        },
        "requires_user_authorization": {
          "const": true
        },
        "auto_contact": {
          "const": false
        }
      },
      "required": [
        "suggested",
        "reasons",
        "requires_user_authorization",
        "auto_contact"
      ]
    },
    "localization": {
      "type": "object",
      "properties": {
        "requested": {
          "type": [
            "string",
            "null"
          ]
        },
        "used": {
          "type": "string"
        },
        "fallback": {
          "type": "boolean"
        },
        "reviewed_by_native_speaker": {
          "type": "boolean"
        }
      },
      "required": [
        "used",
        "fallback"
      ]
    }
  },
  "required": [
    "contract_version",
    "id",
    "data_mode",
    "provenance",
    "observation_id",
    "generated_at",
    "status",
    "condition",
    "environment",
    "map",
    "scouting",
    "recommendations",
    "sources",
    "offline"
  ],
  "additionalProperties": true
}
